Term URI|Origin|Type|Cardinality|Comments|Label_en|Description_en|Example_en|Verified_en|Label_es|Description_es|Example_es|Verified_es|Label_sl|Description_sl|Example_sl|Verified_sl|Label_pt|Description_pt|Example_pt|Verified_pt|Label_fr|Description_fr|Example_fr|Verified_fr
MarriageEvidence|DE4A||||Marriage evidence|Official document or data proving the Marriage of two Persons.||1|Prueba de matrimonio|Información sobre el matrimonio de dos personas que demuestra que se registró formalmente.||1|Poročni dokaz|Uradni dokument ali podatki ki dokazujejo zakonsko zvezo dveh oseb.||1|Certidão de casamento|A certidão de casamento serve como prova do registo de casamento. Inclui os dados de identificação dos membros do casal, a modalidade, o regime de bens e o local onde foi celebrado o casamento.||1|Preuve de mariage|Document officiel ou données prouvant le mariage de deux personnes.||0
MarriageEvidence/Identifier||Identifier|00|It is the identifier from Core Vocabularies (Core Vocabulary Aggregated Components)|Identifier|An unambiguous reference to the Marriage Evidence.||1|Identificador|Referencia inequívoca a la prueba de matrimonio.||1|Identifikator|Nedvoumno sklicevanje na zakonske dokaze.||1|Identificador|Uma referência inequívoca para a certidão do casamento.||1|Identifiant|Une référence sans ambiguïté à la preuve du mariage.||0
MarriageEvidence/IssueDate|udt:DateType|UDT/Date|10|It is the DateType from unqualified data types from UBL-2.3.|Issue date|The most recent date on which the MarriageEvidence instance was issued.|20/05/2021|1|Fecha de emisión|Fecha más reciente en que se emitió la prueba de matrimonio.||1|Datum izdaje|Najnovejši datum na katerem je bil izdan primer Marriageedidence.||1|Data de emissão|A data mais recente em que instância de MarriageEvidence foi emitida.||1|Date d'émission|La date la plus récente sur laquelle l'instance de mariage a été émise.||0
MarriageEvidence/IssuingAuthority||PublicOrganisation|10||Issuing authority|A Public Organisation with official authority in charge of issuing the Marriage Evidence.||1|Autoridad emisora|Organización pública competencias para emitir legalmente la prueba de matrimonio.||1|Organ izdaje|Javna organizacija z uradnim organom ki je zadolžena za izdajo zakonskih zakonov.||1|Autoridade emissora|Uma entidade pública com autoridade oficial para emitir a certidão do casamento.||1|Autorité de délivrance|Une organisation publique avec autorité officielle chargée de la délivrance des preuves du mariage.||0
MarriageEvidence/IssuingPlace||LocationAddress|10||Issuing place|The Location where the Marriage Evidence was issued.||1|Lugar de emisión|Ubicación donde se emitió la evidencia matrimonial.||1|Izdajanje kraja|Lokacijo kjer je bil izdan zakonski dokaz.||1|Local de emissão|A localização onde a certidão do casamento foi emitida.||1|Lieu de délivrance|L'emplacement où la preuve du mariage a été émise.||0
MarriageEvidence/IssuingPlace/AdminUnitL2|location:AdminUnitL2Type|LocationAddress/AdminUnitL2|10|||||1||||1||||1||||1||||0
MarriageEvidence/IssuingPlace/AdminUnitL1|location:AdminUnitL1Type|LocationAddress/AdminUnitL1|10|||||1||||1||||1||||1||||0
MarriageEvidence/CertifiesMarriage|||10||Certifies marriage|Attesting in a formal way that the Marriage is true.|20/04/2021|1|Certifica el matrimonio|Certificación del suceso del matrimonio.||1|Potrjuje poroko|Uradni način da je zakonska zveza resnična.||1|Certifica o casamento|Atestando de uma forma formal que o casamento é verdadeiro.||1|Certifie le mariage|Attestant de manière formelle que le mariage est vrai.||0
MarriageEvidence/CertifiesMarriage/DateOfMarriage|udt:DateType|UDT/Date|10||Date of marriage|The date on which the Marriage took place.||1|Fecha de matrimonio|Fecha en que tuvo lugar la boda.||1|Datum poroke|Datum ko je potekala zakonska zveza.||1|Data do casamento|A data em que ocorreu o casamento.||1|Date du mariage|La date à laquelle le mariage a eu lieu.||0
MarriageEvidence/CertifiesMarriage/PlaceOfMarriage||LocationAddress|00||Place of marriage|||1|Lugar de la boda|||1||||1|Local do casamento|||1|Lieu de mariage|||0
MarriageEvidence/CertifiesMarriage/Spouse||Person|11||Spouse|The Person who was married.||1|Cónyuge|Una de las personas que forman el matrimonio||1|Zakonec|Oseba ki je bila poročena.||1|Cônjuge|A pessoa que era casada.||1|Conjoint|La personne qui était mariée.||0
MarriageEvidence/CertifiesMarriage/Spouse/Gender||PersonGenderEnum|10|||The gender of an individual should be recorded using a controlled vocabulary that is appropriate for the specific context. In some cases the chromosomal or physical state of an individual will be more important than the gender that they express, in others the reverse will be true. What is always important is that the controlled vocabulary used to describe an individual's gender is stated explicitly.||1||El género de un individuo  apropiado para el contexto específico. En algunos casos, el estado cromosómico o físico de un individuo será más importante que el género que expresan, en será al contrario.||1||||1||O género de um indivíduo deve ser registado usando um vocabulário controlado que seja apropriado para o contexto específico. Em alguns casos, o estado cromossómico ou físico de um indivíduo será mais importante que o género que ele expressa, em outros casos o inverso poderá ser verdadeiro. O que é sempre importante é que o vocabulário controlado usado para descrever o género de um indivíduo seja declarado explicitamente.||1||Le sexe d'une personne doit être enregistré en utilisant un vocabulaire contrôlé approprié pour le contexte spécifique. Dans certains cas, l'état chromosomique ou physique d'une personne sera plus important que le sexe qu'ils expriment, dans d'autres l'inverse seront vrais. Ce qui est toujours important, c'est que le vocabulaire contrôlé utilisé pour décrire le genre d'un individu est indiqué explicitement.||0
MarriageEvidence/CertifiesMarriage/Spouse/FamilyNameAfterMarriage|udt:TextType|UDT/Text|01||Family name after marriage|This property contains the family name after the Marriage of the Person.|Maria|1|Apellidos después del matrimonio|Apellidos del cónyuge después del matrimonio, que diferirán de los de antes del matrimonio en caso de que el suceso cambie alguno.||1|Družinsko ime po poroki|Spol posameznika je treba zabeležiti z uporabo nadzorovanega besedišča ki je primeren za poseben kontekst. V nekaterih primerih bo kromosomsko ali fizično stanje posameznika pomembnejše od spola ki ga izražajo v drugih pa bo vzvratno res. Vedno je pomembno da je nadzorovani besednjak ki se uporablja za opis spola posameznika izrecno navedeno.||1|Apelido após o casamento|Esta propriedade contém o apelido após o casamento da pessoa.||1|Nom de famille après le mariage|Cette propriété contient le nom de famille après le mariage de la personne.||0
MarriageEvidence/CertifiesMarriage/Spouse/FamilyNameBeforeMarriage|udt:TextType|UDT/Text|01||Family name before marriage|This property contains the family name before the Marriage of the Person.|Maria Khan|1|Apellidos antes del matrimonio|Apellidos del cónyuge después del matrimonio, que diferirán de los de después del matrimonio en caso de que el suceso cambie alguno.||1|Družinsko ime pred poroko|Ta lastnost vsebuje družinsko ime po zakonu osebe.||1|Apelido antes do casamento|Esta propriedade contém o apelido antes do casamento da pessoa.||1|Nom de famille avant le mariage|Cette propriété contient le nom de famille avant le mariage de la personne.||0
MarriageEvidence/CertifiesMarriage/Spouse/MaritalStatusBeforeMarriage||PersonMaritalStatusEnum|00||Marital status before marriage|Situation with regard to whether a Person was single, married, separated, divorced or widowed.||1|Estado civil antes del matrimonio.|Situación con respecto a si una persona era soltera, casada, separada, divorciada o viuda antes de contraer el matrimonio que se certifica.||1|Zakonski stan pred poroko|Ta lastnost vsebuje družinsko ime pred poroko osebe.||1|Estado civil antes do casamento|Situação em relação a se uma pessoa era solteira, casada, separada, divorciada ou viúva.||1|État matrimonial avant le mariage|Situation en ce qui concerne si une personne était célibataire, mariée, séparée, divorcée ou veuve.||0
MarriageEvidence/CertifiesEndOfMarriage|||10||End of marriage|In case of divorce, this property includes information on the end of marriage|05/01/2022|1|Fin del matrimonio|En caso de divorcio, esta propiedad incluye información sobre el final del matrimonio.||1|Konec zakonske zveze|Razmere glede tega ali je bila oseba samska poročena ločena razvezana ali vdova.||1|Fim do casamento|Em caso de divórcio, esta propriedade inclui informações sobre o final do casamento||1|Fin du mariage|En cas de divorce, cette propriété inclut des informations sur la fin du mariage.||0
MarriageEvidence/CertifiesEndOfMarriage/DateOfEndOfMarriage|udt:DateType|UDT/Date|00||Date of end of marriage|Date of the end of marriage|lack of communication|1|Fecha de terminación del matrimonio.|Fecha en que matrimonio queda formalmente disuelto.||1|Datum konca zakonske zveze|V primeru razveze ta lastnost vključuje informacije na koncu poroke||1|Data de término do casamento|Data em que o casamento é formalmente dissolvido||1|Date de fin du mariage|Date de la fin du mariage||0
MarriageEvidence/CertifiesEndOfMarriage/Cause|udt:TextType|UDT/Text|00||Cause|Cause of the end of marriage.||1|Causa|Causa que formalmente consituye el motivo de la disolución del matrimonio.||1|Vzrok|Datum konca zakonske zveze||1|Causa|Causa que constitui formalmente o motivo da dissolução do casamento.||1|Causer|Cause de la fin du mariage.||0
